{
	"$schema": "../../schema/affrescoui-app.schema.json",
	"format": "affrescoui-app",
	"version": 1,
	"id": "modello",
	"name": "Modello",
	"description": "A 3D modeller written only as screen documents.",
	"entry": "index.screen.json",
	"capabilities": {
		"files": "Saves and opens your scenes where you choose.",
		"assistant": "Answers your questions about your models, with the assistant you set up in Settings."
	},
	"assets": [
		"samples"
	]
}
