{
	"$schema": "../../../schema/affrescoui-app.schema.json",
	"format": "affrescoui-app",
	"version": 1,
	"id": "code-editor",
	"name": "Quaderno",
	"description": "A code editor: files and folders, tabs, a minimap, search and a terminal.",
	"entry": "index.screen.lisp",
	"capabilities": {
		"assistant": "Answers your questions about your code, with the assistant you set up in Settings."
	}
}
